{
  "$schema": "https://json-schema.org/draft/2020-12/schema",
  "$id": "evidence-lab-plugins/schemas/meta.schema.json",
  "title": "Evidence Lab plugin metadata",
  "description": "Registry metadata kept outside plugin.json so the native manifest stays compatible with Claude Code. Carries provenance, review trail and distribution class.",
  "type": "object",
  "required": ["status", "category", "risk_level", "owner", "reviewer", "provenance", "skills"],
  "additionalProperties": false,
  "properties": {
    "status": {
      "enum": ["reference", "draft", "review", "production", "deprecated"],
      "description": "reference = template only, never installed for real work. draft = proposed, not reviewed. production = passed review and at least one real run."
    },
    "category": {
      "enum": ["research", "education", "writing", "operations"],
      "description": "Marketplace category. Keep the list short; add a value only when two plugins need it."
    },
    "risk_level": {
      "enum": ["team_safe", "internal_only"],
      "description": "team_safe = shareable with the whole team. internal_only = touches internal infrastructure, stays out of exports."
    },
    "owner": { "type": "string", "description": "Who owns the result." },
    "reviewer": { "type": "string", "description": "Who signs off changes. Must differ from owner for production status." },
    "provenance": {
      "type": "object",
      "required": ["origin", "evidence", "added_at"],
      "additionalProperties": false,
      "properties": {
        "origin": {
          "type": "string",
          "description": "Where the knowledge came from: whose practice, which instance, which engagement."
        },
        "evidence": {
          "type": "array",
          "minItems": 1,
          "items": { "type": "string" },
          "description": "Links or references backing the procedure. A skill without evidence is somebody's guess."
        },
        "added_at": { "type": "string", "pattern": "^\\d{4}-\\d{2}-\\d{2}$" },
        "reviewed_at": { "type": "string", "pattern": "^\\d{4}-\\d{2}-\\d{2}$" }
      }
    },
    "skills": {
      "type": "array",
      "minItems": 1,
      "items": {
        "type": "object",
        "required": ["name", "summary"],
        "additionalProperties": false,
        "properties": {
          "name": { "type": "string", "pattern": "^[a-z0-9][a-z0-9-]*[a-z0-9]$" },
          "summary": { "type": "string", "minLength": 20 },
          "deterministic_parts": {
            "type": "array",
            "items": { "type": "string" },
            "description": "Scripts that produce the repeatable artefact. The model reasons; these files make the output reproducible."
          }
        }
      }
    },
    "portable_to": {
      "type": "array",
      "items": { "enum": ["claude", "codex", "chatgpt", "hermes"] },
      "description": "Runtimes the skills were checked against. Empty means Claude Code only."
    }
  }
}
