{
  "status": "draft", "category": "research", "risk_level": "team_safe", "owner": "Tim", "reviewer": "Tim",
  "provenance": {"origin": "Evidence Lab split of the former full-research-cycle pack using R3 scenario evidence; procedures retain their pinned K-Dense provenance.", "evidence": ["docs/pack-boundary-report.md", "https://github.com/K-Dense-AI/scientific-agent-skills/tree/36d8f13a1e754618794bf42f417884940077b4ae"], "added_at": "2026-08-26"},
  "skills": [
    {"name": "experimental-design", "summary": "Produces an interpretable study design, randomization or blocking plan, and reproducible layout.", "deterministic_parts": ["scripts/doe_designs.py", "scripts/randomization.py"]},
    {"name": "hypothesis-generation", "summary": "Turns observations into testable hypotheses, rivals, predictions, measurements, and preregistration artefacts.", "deterministic_parts": ["scripts/validate_hypothesis_schema.py", "scripts/validate_prediction_matrix.py", "scripts/generate_preregistration_scaffold.py"]}
  ],
  "portable_to": ["claude", "codex"]
}
