{
  "status": "draft", "category": "research", "risk_level": "team_safe", "owner": "Tim", "reviewer": "Tim",
  "provenance": {"origin": "Evidence Lab split of the former data-and-pdf pack using R3 scenario evidence; procedures retain pinned K-Dense provenance.", "evidence": ["docs/pack-boundary-report.md", "https://github.com/K-Dense-AI/scientific-agent-skills/tree/36d8f13a1e754618794bf42f417884940077b4ae"], "added_at": "2026-08-26"},
  "skills": [
    {"name": "database-lookup", "summary": "Retrieves facts reproducibly from documented public database APIs with explicit filters and provenance.", "deterministic_parts": []},
    {"name": "exploratory-data-analysis", "summary": "Profiles supported local research data and reports quality, missingness, leakage, and sensitivity diagnostics.", "deterministic_parts": ["scripts/eda_analyzer.py", "scripts/tabular_profile.py", "scripts/missingness_leakage_audit.py"]}
  ],
  "portable_to": ["claude", "codex"]
}
