{
  "status": "draft",
  "category": "research",
  "risk_level": "team_safe",
  "owner": "Tim",
  "reviewer": "Tim",
  "provenance": {
    "origin": "Evidence Lab curation of cross-disciplinary research procedures from a pinned K-Dense Scientific Agent Skills revision and an existing bilingual writing workflow.",
    "evidence": [
      "https://github.com/K-Dense-AI/scientific-agent-skills/tree/36d8f13a1e754618794bf42f417884940077b4ae",
      "Evidence Lab skill catalog review dated 2026-08-25"
    ],
    "added_at": "2026-08-25"
  },
  "skills": [
    {
      "name": "citation-management",
      "summary": "Finds, verifies, deduplicates, and formats scholarly citation metadata and BibTeX.",
      "deterministic_parts": ["scripts/validate_citations.py", "scripts/format_bibtex.py"]
    },
    {
      "name": "database-lookup",
      "summary": "Retrieves facts reproducibly from documented public database APIs with explicit filters and provenance.",
      "deterministic_parts": []
    },
    {
      "name": "experimental-design",
      "summary": "Produces an interpretable study design, randomization or blocking plan, and reproducible layout.",
      "deterministic_parts": ["scripts/doe_designs.py", "scripts/randomization.py"]
    },
    {
      "name": "exploratory-data-analysis",
      "summary": "Profiles supported local research data and reports quality, missingness, leakage, and sensitivity diagnostics.",
      "deterministic_parts": ["scripts/eda_analyzer.py", "scripts/tabular_profile.py", "scripts/missingness_leakage_audit.py"]
    },
    {
      "name": "hypothesis-generation",
      "summary": "Turns observations into testable hypotheses, rivals, predictions, measurements, and preregistration artefacts.",
      "deterministic_parts": ["scripts/validate_hypothesis_schema.py", "scripts/validate_prediction_matrix.py", "scripts/generate_preregistration_scaffold.py"]
    },
    {
      "name": "literature-review",
      "summary": "Produces a documented review protocol, screening trail, evidence table, synthesis, and verified bibliography.",
      "deterministic_parts": ["scripts/search_databases.py", "scripts/verify_citations.py", "scripts/generate_pdf.py"]
    },
    {
      "name": "markdown-mermaid-writing",
      "summary": "Creates versionable Markdown documents and Mermaid diagrams from reusable templates and style rules.",
      "deterministic_parts": []
    },
    {
      "name": "markitdown",
      "summary": "Converts supported local documents and selected sources to normalized Markdown for analysis and indexing.",
      "deterministic_parts": ["scripts/batch_convert.py", "scripts/convert_literature.py", "scripts/inspect_installation.py"]
    },
    {
      "name": "paper-lookup",
      "summary": "Searches scholarly APIs and returns deduplicated paper records, identifiers, provenance, and available full text.",
      "deterministic_parts": ["scripts/paginate.py", "scripts/jats_to_text.py", "scripts/openalex_abstract.py"]
    },
    {
      "name": "peer-review",
      "summary": "Builds an evidence-bounded manuscript assessment with claim, method, statistics, ethics, and reproducibility checks.",
      "deterministic_parts": ["scripts/generate_review_scaffold.py", "scripts/validate_claim_evidence.py", "scripts/lint_review.py"]
    },
    {
      "name": "scientific-critical-thinking",
      "summary": "Audits claims, assumptions, causal language, bias, confounding, and evidence quality.",
      "deterministic_parts": []
    },
    {
      "name": "scientific-visualization",
      "summary": "Designs and audits truthful, accessible, publication-oriented scientific figures and export settings.",
      "deterministic_parts": ["scripts/palette_audit.py", "scripts/figure_export.py", "scripts/image_metadata.py"]
    },
    {
      "name": "statistical-analysis",
      "summary": "Produces a confirmed analysis plan, diagnostics, effect sizes, uncertainty, and bounded statistical reporting.",
      "deterministic_parts": ["scripts/assumption_checks.py"]
    },
    {
      "name": "statistical-power",
      "summary": "Calculates power, sample size, sensitivity, or minimum detectable effects from explicit assumptions.",
      "deterministic_parts": ["scripts/power.py", "scripts/simulate_power.py"]
    },
    {
      "name": "uncertainty-and-units",
      "summary": "Checks units, performs conversions, propagates uncertainty, and formats results with an audit trail.",
      "deterministic_parts": ["scripts/audit_units.py", "scripts/convert_units.py", "scripts/propagate_uncertainty.py"]
    },
    {
      "name": "writing-skill",
      "summary": "Routes evidence-bounded Russian or English writing by genre, including an academic and scientific mode.",
      "deterministic_parts": []
    }
  ]
}
