{
  "status": "draft",
  "category": "research",
  "risk_level": "team_safe",
  "owner": "Tim",
  "reviewer": "Tim",
  "provenance": {
    "origin": "Evidence Lab decomposition of research workflow procedures from a pinned K-Dense Scientific Agent Skills revision and a bilingual writing workflow.",
    "evidence": ["https://github.com/K-Dense-AI/scientific-agent-skills/tree/36d8f13a1e754618794bf42f417884940077b4ae", "Evidence Lab architecture review dated 2026-08-26"],
    "added_at": "2026-08-26"
  },
  "skills": [
    {"name": "experimental-design", "summary": "Produces an interpretable study design, randomization or blocking plan, and reproducible layout.", "deterministic_parts": ["scripts/doe_designs.py", "scripts/randomization.py"]},
    {"name": "hypothesis-generation", "summary": "Turns observations into testable hypotheses, rivals, predictions, measurements, and preregistration artefacts.", "deterministic_parts": ["scripts/validate_hypothesis_schema.py", "scripts/validate_prediction_matrix.py", "scripts/generate_preregistration_scaffold.py"]},
    {"name": "literature-review", "summary": "Produces a documented review protocol, screening trail, evidence table, synthesis, and verified bibliography.", "deterministic_parts": ["scripts/search_databases.py", "scripts/verify_citations.py", "scripts/generate_pdf.py"]},
    {"name": "markdown-mermaid-writing", "summary": "Creates versionable structural diagrams and consistent Markdown layouts using Mermaid and focused style rules.", "deterministic_parts": []},
    {"name": "peer-review", "summary": "Builds an evidence-bounded manuscript assessment with claim, method, statistics, ethics, and reproducibility checks.", "deterministic_parts": ["scripts/generate_review_scaffold.py", "scripts/validate_claim_evidence.py", "scripts/lint_review.py"]},
    {"name": "writing-skill", "summary": "Routes evidence-bounded Russian or English writing by genre, including an academic and scientific mode.", "deterministic_parts": []}
  ],
  "portable_to": ["claude", "codex"]
}
