{
  "status": "draft",
  "category": "research",
  "risk_level": "team_safe",
  "owner": "Tim",
  "reviewer": "Tim",
  "provenance": {
    "origin": "Evidence Lab compatibility boundary created from the R3 scenario and over-installation analysis.",
    "evidence": ["docs/pack-boundary-report.md", "catalog/pack-boundary-decisions.json"],
    "added_at": "2026-08-26"
  },
  "skills": [
    {"name": "data-and-pdf-router", "summary": "Explains and confirms the compatibility route that installs document and structured-data workflow packs together.", "deterministic_parts": []}
  ],
  "portable_to": ["claude", "codex"]
}
