{
  "status": "draft",
  "category": "research",
  "risk_level": "team_safe",
  "owner": "Tim",
  "reviewer": "Tim",
  "provenance": {
    "origin": "Evidence Lab decomposition of quantitative research procedures from a pinned K-Dense Scientific Agent Skills revision.",
    "evidence": ["https://github.com/K-Dense-AI/scientific-agent-skills/tree/36d8f13a1e754618794bf42f417884940077b4ae", "Evidence Lab architecture review dated 2026-08-26"],
    "added_at": "2026-08-26"
  },
  "skills": [
    {"name": "scientific-visualization", "summary": "Designs and audits truthful, accessible, publication-oriented scientific figures and export settings.", "deterministic_parts": ["scripts/palette_audit.py", "scripts/figure_export.py", "scripts/image_metadata.py"]},
    {"name": "statistical-analysis", "summary": "Produces a confirmed analysis plan, diagnostics, effect sizes, uncertainty, and bounded statistical reporting.", "deterministic_parts": ["scripts/assumption_checks.py"]},
    {"name": "statistical-power", "summary": "Calculates power, sample size, sensitivity, or minimum detectable effects from explicit assumptions.", "deterministic_parts": ["scripts/power.py", "scripts/simulate_power.py"]},
    {"name": "uncertainty-and-units", "summary": "Checks units, performs conversions, propagates uncertainty, and formats results with an audit trail.", "deterministic_parts": ["scripts/audit_units.py", "scripts/convert_units.py", "scripts/propagate_uncertainty.py"]}
  ],
  "portable_to": ["claude", "codex"]
}
