{
  "status": "reference",
  "category": "operations",
  "risk_level": "team_safe",
  "owner": "Tim",
  "reviewer": "Misha",
  "provenance": {
    "origin": "Adapted from Tim's Hermes Task Intake and Lean Focus v2 practices for the Evidence Lab operational board.",
    "evidence": [
      "Notion: Hermes Task Intake skill",
      "Notion: Lean Focus v2 methodology",
      "Notion: Evidence Lab Team Board"
    ],
    "added_at": "2026-08-27"
  },
  "skills": [
    {
      "name": "evidence-lab-task-intake",
      "summary": "Creates language-consistent task cards, applies execution gates, and produces a deterministic per-owner priority order.",
      "deterministic_parts": ["scripts/rank_tasks.py"]
    }
  ],
  "portable_to": ["claude", "codex"]
}
